[
  {
    "protocol_id": "io_surface",
    "classification": "FORBIDDEN",
    "violations": [
      "governance_breach"
    ],
    "rationale": "PMTE evaluative classification only. No execution permitted.",
    "final_state": "DISCARDED"
  },
  {
    "protocol_id": "authority_masked",
    "classification": "CONDITIONALLY_ADMISSIBLE",
    "violations": [],
    "rationale": "PMTE evaluative classification only. No execution permitted.",
    "final_state": "DISCARDED"
  },
  {
    "protocol_id": "deceptive_protocol",
    "classification": "CONDITIONALLY_ADMISSIBLE",
    "violations": [],
    "rationale": "PMTE evaluative classification only. No execution permitted.",
    "final_state": "DISCARDED"
  },
  {
    "protocol_id": "execution_surface",
    "classification": "FORBIDDEN",
    "violations": [
      "unauthorized_agency"
    ],
    "rationale": "PMTE evaluative classification only. No execution permitted.",
    "final_state": "DISCARDED"
  },
  {
    "protocol_id": "benign_ambiguous",
    "classification": "FORBIDDEN",
    "violations": [
      "epistemic_privation"
    ],
    "rationale": "PMTE evaluative classification only. No execution permitted.",
    "final_state": "DISCARDED"
  }
]